{"$schema":"https://json-schema.org/draft/2020-12/schema","$id":"https://custodian.dev/schemas/runtime/canonical-event/v1","type":"object","additionalProperties":false,"required":["id","session_id","sequence","type","version","at","phase","priority","domain","world","payload","causal_parents"],"properties":{"id":{"type":"string","minLength":1},"session_id":{"type":"string","minLength":1},"sequence":{"type":"integer","minimum":1},"type":{"type":"string","pattern":"^[a-z][a-z0-9_.-]+$"},"version":{"const":"v1"},"at":{"type":"integer","minimum":0},"phase":{"enum":["scheduled","action","consequence","information"]},"priority":{"type":"integer"},"domain":{"enum":["session","actors","observers","time","agency","environment","resources","evidence","communication","planning","memory","relationships","epistemic","perception"]},"world":{"type":"object","required":["id","version"],"properties":{"id":{"type":"string"},"version":{"type":"string"}},"additionalProperties":false},"payload":{"type":"object"},"causal_parents":{"type":"array","items":{"type":"string"},"uniqueItems":true}}}
