[{"id":"e1","session_id":"reference-session","sequence":1,"type":"environment.hazard.started","version":"v1","at":1,"phase":"scheduled","priority":0,"domain":"environment","world":{"id":"reference-convergence","version":"1.0.0"},"payload":{"hazards":{"fire-b":{"active":true}}},"causal_parents":[]},{"id":"e2","session_id":"reference-session","sequence":2,"type":"communication.message.delivered","version":"v1","at":2,"phase":"information","priority":0,"domain":"communication","world":{"id":"reference-convergence","version":"1.0.0"},"payload":{"speaker":"agent-b","recipient":"agent-a","claim":"door-a-b is unlocked","truth":"false"},"causal_parents":["e1"]},{"id":"e3","session_id":"reference-session","sequence":3,"type":"epistemic.belief.recorded","version":"v1","at":2,"phase":"information","priority":1,"domain":"epistemic","world":{"id":"reference-convergence","version":"1.0.0"},"payload":{"agent":"agent-a","kind":"beliefs","claim":"door-a-b is unlocked","basis":"message:e2"},"causal_parents":["e2"]},{"id":"e4","session_id":"reference-session","sequence":4,"type":"planning.plan.recorded","version":"v1","at":3,"phase":"action","priority":0,"domain":"planning","world":{"id":"reference-convergence","version":"1.0.0"},"payload":{"agent":"agent-a","plan":"exit-through-door"},"causal_parents":["e3"]},{"id":"e5","session_id":"reference-session","sequence":5,"type":"agency.action.failed","version":"v1","at":4,"phase":"consequence","priority":0,"domain":"agency","world":{"id":"reference-convergence","version":"1.0.0"},"payload":{"agent":"agent-a","action":"open-door","reason":"locked"},"causal_parents":["e4"]},{"id":"e6","session_id":"reference-session","sequence":6,"type":"evidence.trace.created","version":"v1","at":4,"phase":"consequence","priority":1,"domain":"evidence","world":{"id":"reference-convergence","version":"1.0.0"},"payload":{"kind":"environmental_trace","claim":"door-a-b remained locked","origin":"e5"},"causal_parents":["e5"]},{"id":"e7","session_id":"reference-session","sequence":7,"type":"memory.experience.formed","version":"v1","at":5,"phase":"information","priority":0,"domain":"memory","world":{"id":"reference-convergence","version":"1.0.0"},"payload":{"agent":"agent-a","content":"The door was locked.","source":"e6"},"causal_parents":["e6"]},{"id":"e8","session_id":"reference-session","sequence":8,"type":"relationships.trust.adjusted","version":"v1","at":5,"phase":"information","priority":1,"domain":"relationships","world":{"id":"reference-convergence","version":"1.0.0"},"payload":{"agent":"agent-a","subject":"agent-b","delta":-0.4,"reason":"contradicted-message"},"causal_parents":["e7"]},{"id":"e9","session_id":"reference-session","sequence":9,"type":"resources.transfer.committed","version":"v1","at":6,"phase":"action","priority":0,"domain":"resources","world":{"id":"reference-convergence","version":"1.0.0"},"payload":{"key":{"custodian":"agent-b"}},"causal_parents":["e8"]},{"id":"e10","session_id":"reference-session","sequence":10,"type":"environment.door.unlocked","version":"v1","at":7,"phase":"consequence","priority":0,"domain":"environment","world":{"id":"reference-convergence","version":"1.0.0"},"payload":{"connections":{"door-a-b":{"locked":false}},"repairs":["door-a-b"]},"causal_parents":["e9"]},{"id":"e11","session_id":"reference-session","sequence":11,"type":"agency.action.succeeded","version":"v1","at":8,"phase":"consequence","priority":0,"domain":"agency","world":{"id":"reference-convergence","version":"1.0.0"},"payload":{"agent":"agent-a","action":"exit-room-a","result":"committed"},"causal_parents":["e10"]}]
